"4414","coicere","coici","coicere","coiēc","coiectus","一緒に投げる、一緒にする、結合する、接続する、駆動する、強制する、何かを投げつける、発送する、割り当てる、手放す、促す、圧力をかける、提案する、予言する、予言する、結論する、推測する、論争する、論争する、議論する、行く、急ぐ","to throw together, to bring together, to unite, to connect, to drive, to force, to hurl something, to dispatch, to assign, to make go, to urge, to press, to adduce, to prophesy, to foretell, to forebode, to conclude, to guess, to dispute, to contend, to discuss, to go, to hurry","3a","0","0","0","0","0"
"4415","collinere","collin","collinere","collēv","collitus","覆い隠す、汚す、汚す、汚す","to cover over, to besmear, to pollute, to defile","3","0","0","0","0","0"
"4416","colliquēscere","colliquēsc","colliquēscere","-","-","溶ける、液化する、溶解する","to melt, to liquefy, to dissolve","3","0","1","0","1","0"
"4417","commeminisse","-","commeminisse","commemin","-","暗記する","to remember clearly","3","0","1","1","0","0"
"4418","compellere","compell","compellere","compul","compulsus","集める、集める、押し合わせる、強要する、一定の状態に還元する、力ずくで状態に還元する、促す","to gather, to collect, to push together, to compel, to reduce to certain condition, reduce to state by force, to urge","3","0","0","0","0","0"
"4419","compingere","comping","compingere","compēg","compāctus","付ける、結びつける、結合する、構成する、封じ込める、隠す","to attach, to bind, to join together, to construct, to confine, to conceal","3","0","0","0","0","0"
"4420","complūere","complūi","complūere","complūv","-","雨が降る","to rain","3a","0","1","0","0","1"
"4421","compōnere","compōn","compōnere","composu","conpositus","手配する、編纂する、構成する、構成する、編成する、注文する、建てる、築く、なだめる、和らげる、解決する、落ち着かせる、なだめる、静める、落ち着かせる、和解する、支払いを修正する","to arrange, to compile, to compose, to make up, organize, to order, to construct, to build, to pacify, to allay, to settle, to calm, to appease, to quiet, to tranquillize, to reconcile, to pay amends","3","0","0","0","0","0"
"4422","computrescere","computresc","computrescere","-","-","腐敗する","to putrefy","3","0","1","0","1","0"
"4423","concalefacere","concalefaci","concalefacere","concalefēc","concalefactus","しっかり温める","to warm thoroughly","3a","0","0","0","0","0"
"4424","concalescere","concalesc","concalescere","-","-","熱くなる、熱で光る","to become hot, to glow with heat","3","0","1","0","1","0"
"4425","concallescere","concallesc","concallescere","-","-","無神経になる、鈍感になる、賢くなる","to become callous, to become insensitive, to become shrewd","3","0","1","0","1","0"
"4426","concernere","concern","concernere","concrēv","concrētus","混ぜる、ふるいにかける、混ぜ合わせる","to mix, to sift together, to mingle together","3","0","0","0","0","0"
"4427","concipere","concipi","concipere","concēp","conceptus","受け取る、掴む、攫む、由来する、収容する、保持する、知的に理解する、考える、採用する、工夫する、想像する","to receive, to catch, to grasp, to derive from, to contain, to hold, to comprehend intellectually, to think, to adopt, to devise, to conceive","3a","0","0","0","0","0"
"4428","concrēdere","concrēd","concrēdere","concrēdid","concrēditus","委ねる、委託する、託す、打ち明ける","to entrust, to consign, to commit, to confide","3","0","0","0","0","0"
"4429","concrescere","concresc","concrescere","-","-","濃くなる、凝結する、凝固する、硬化する、凝結する","to thicken, to condense, to curdle, to stiffen, to congeal","3","0","1","0","1","0"
"4430","concumbere","concumb","concumbere","concubu","concubitum","一緒に寝る、ベッドを共にする、一緒に寝る","to lie with, to share the bed of, to sleep with","3","0","0","0","0","0"
"4431","concupīscere","concupīsc","concupīscere","concupīv","concupītus","欲しがる、切望する、切望する","to desire, to covet, to long for","3","0","0","0","0","0"
"4432","condecernere","condecern","condecernere","condēcrēv","condēcrētus","決める、一緒に解決する、一緒に決定する","to decide, to settle together, to determine together","3","0","0","0","0","0"
"4433","condiscere","condisc","condiscere","condidic","-","徹底的に学ぶ","to learn thoroughly","3","0","1","0","0","0"
"4434","condolescere","condolesc","condolescere","-","-","激しい痛みを感じ始める、ひどく苦しみ始める、痛み始める","to begin to feel severe pain, to begin to suffer greatly, to begin to ache","3","0","1","0","1","0"
"4435","condormiscere","condormisc","condormiscere","condormīv","-","眠りにつく、眠りにつく","to fall asleep, to go to sleep","3","0","1","0","0","0"
"4436","cōnectere","cōnect","cōnectere","cōnexu","cōnexus","接続する、繋げる、結合する、先行するものに結合する","to connect, to link, to fasten together, to join to what precedes","3","0","0","0","0","0"
"4437","cōnfervēscere","cōnfervēsc","cōnfervēscere","-","-","沸騰する、熱くなる、治る","to begin to boil, to grow hot, to heal","3","0","1","0","1","0"
"4438","cōnficere","cōnfici","cōnficere","cōnfēc","cōnfectus","準備する、達成する、完了する、実行する、解決する、取引を成立させる、横切る、横断する、生成する、引き起こす、もたらす、結果をもたらす、確保する、完了する、終了する、費やす、通過する 完成する、調達する、集める、集める、生産する、準備する、実行する、祝う、示す、推測する、実証する、減少させる、減らす、磨耗させる、消費する、枯渇させる 、破壊する、殺す","to prepare, to accomplish, to complete, to execute, to settle, to close bargain, to traverse, to produce, to cause, to bring about, to effect, to secure, to finish, to end, to spend, to pass, to complete, to procure, to bring together, to collect, to produce, to prepare, to perform, to celebrate, to show, to deduce, to demonstrate, to diminish, to lessen, to wear out, to consume, to exhaust, to destroy, to kill","3a","0","0","0","0","0"
"4439","cōnfodere","cōnfodi","cōnfodere","cōnfōd","cōnfossus","掘る、掘る、掘る、あたりを掘る、土地をひっくり返す、掘って準備する、刺して倒す、突き刺す、突き刺す、突き刺す、傷つける","to dig, to dig up, to dig over, to dig round about, to turn over of land, to prepare by digging, to strike down by stabbing, to pierce, to stab, to transfix, to damage","3a","0","0","0","0","0"
"4440","cōnfringere","cōnfring","cōnfringere","cōnfrēg","cōnfrāctus","粉々にする、破壊する","to break into pieces, to destroy","3","0","0","0","0","0"
"4441","cōnfugere","cōnfugi","cōnfugere","cōnfūg","cōnfugitus","逃げる、避難する、頼る、訴える","to flee, to take refuge, to have recourse to, to appeal to","3a","0","0","0","0","0"
"4442","cōnfundere","cōnfund","cōnfundere","cōnfūd","cōnfūsus","注ぐ、混ざる、かき混ぜる、拡散する、充満する、広がる、団結する、混ざり合う、結合する、結合する、混ざり合う、混同する、混同する、混同する、無秩序にする 、当惑させる、当惑させる","to pour, to mingle, to stir up, to diffuse, to suffuse, to spread over, to unite, to mix together, to join, to combine, to mingle, to confound, to confuse, to jumble together, to bring into disorder, to disconcert, to perplex","3","0","0","0","0","0"
"4443","conicere","conici","conicere","coniēc","coniectus","一緒に投げる、一緒にする、結合する、接続する、駆動する、強制する、何かを投げつける、発送する、割り当てる、手放す、促す、圧力をかける、提案する、予言する、予言する 予言する、結論する、推測する、論争する、論争する、議論する、行く、急ぐ","to throw together, to bring together, to unite, to connect, to drive, to force, to hurl something, to dispatch, to assign, to make go, to urge, to press, to adduce, to prophesy, to foretell, to forebode, to conclude, to guess, to dispute, to contend, to discuss, to go, to hurry","3a","0","0","0","0","0"
"4444","coniicere","coniici","coniicere","coniēc","coniectus","一緒に投げる、一緒にする、結合する、接続する、駆動する、強制する、何かを投げつける、発送する、割り当てる、手放す、促す、圧力をかける、提案する、予言する、予言する 予言する、結論する、推測する、論争する、論争する、議論する、行く、急ぐ","to throw together, to bring together, to unite, to connect, to drive, to force, to hurl something, to dispatch, to assign, to make go, to urge, to press, to adduce, to prophesy, to foretell, to forebode, to conclude, to guess, to dispute, to contend, to discuss, to go, to hurry","3a","0","0","0","0","0"
"4445","conjicere","conjici","conjicere","conjēc","conjectus","一緒に投げる、一緒にする、結合する、接続する、駆動する、強制する、何かを投げつける、発送する、割り当てる、手放す、促す、圧力をかける、提案する、予言する、予言する 予言する、結論する、推測する、論争する、論争する、議論する、行く、急ぐ","to throw together, to bring together, to unite, to connect, to drive, to force, to hurl something, to dispatch, to assign, to make go, to urge, to press, to adduce, to prophesy, to foretell, to forebode, to conclude, to guess, to dispute, to contend, to discuss, to go, to hurry","3a","0","0","0","0","0"
"4446","conligere","conlig","conligere","conlēg","conlēctus","集める、引く、集める、集める、集める、集める、拾う、収縮する、引き上げる、圧縮する、集中する、収穫する、厚くする、厚くする、結びつける、まとめる、得る、獲得する、取得する、生産する、収集する、考える、重さを量る、検討する、推測する、結論する、推測する、 集まる、気を引き締める、心を落ち着ける、勇気を取り戻す、決意を取り戻す、達する、来る、伸びる、数えられる","to gather, to draw, to bring together, to collect together, to assemble, to pick up, to contract, to draw up, to compress, to concentrate, to harvest, to make thick, to thicken, to bind together, to mass together, to get, to gain, to acquire, to produce, to collect, to think upon, to weigh, to consider, to deduce, to conclude, to infer, to gather, to collect oneself, to compose oneself, to recover ones courage, to recover ones  resolution, to amount to, to come to, to extend, to be reckoned","3","0","0","0","0","0"
"4447","connectere","connect","connectere","connexu","connexus","接続する、繋げる、結合する、先行するものに結合する","to connect, to link, to fasten together, to join to what precedes","3","0","0","0","0","0"
"4448","conpellere","conpell","conpellere","conpul","conpulsus","集める、集める、押し合わせる、強要する、一定の状態に還元する、力ずくで状態に還元する、促す","to gather, to collect, to push together, to compel, to reduce to certain condition, reduce to state by force, to urge","3","0","0","0","0","0"
"4449","conpingere","conping","conpingere","conpēg","conpāctus","付ける、結びつける、結合する、構成する、封じ込める、隠す","to attach, to bind, to join together, to construct, to confine, to conceal","3","0","0","0","0","0"
"4451","conputrescere","conputresc","conputrescere","-","-","腐敗する","to putrefy","3","0","1","0","1","0"
"4452","conquaerere","conquaer","conquaerere","conquaesīv","conquaesītus","探す、探す、熱心に探す、入念に探す、探しに行く、集める、集める、調べる、探す","to seek for, to hunt up, to search out eagerly, to search out carefully, to go in quest of, to collect, to bring together, to investigate, to search out","3","0","0","0","0","0"
"4453","conquiēscere","conquiēsc","conquiēscere","-","-","休む、不活発になる、不活性化する","to rest, to be inactive","3","0","1","0","1","0"
"4454","conquirere","conquir","conquirere","conquīsīv","conquīsītus","探す、探す、熱心に探す、入念に探す、探しに行く、集める、集める、調べる、探す","to seek for, to hunt up, to search out eagerly, to search out carefully, to go in quest of, to collect, to bring together, to investigate, to search out","3","0","0","0","0","0"
"4455","cōnsenēscere","cōnsenēsc","cōnsenēscere","-","-","成長する、老いる、一緒に白髪になる、仕事で老いる、弱くなる、虚弱になる、無力になる、衰弱する、衰退する、衰退する、尊敬を失う","to grow, to become old, to grey together, to grow old in occupation, to become weak, to become infirm, to become powerless, to waste away, to decay, to fade, to lose respect","3","0","1","0","1","0"
"4456","cōnscindere","cōnscind","cōnscindere","cōnscid","cōnscissus","バラバラに引き裂く、バラバラに引き裂く","to tear to pieces, to rend to pieces","3","0","0","0","0","0"
"4457","cōnscīscere","cōnscīsc","cōnscīscere","cōnscīv","cōnscītus","承認する、決定する、決定する、規定する、制定する、何かを決定する、何かを解決する、自分で裁定する、自分で決定する、自分に適切にする","to approve of, to decree, to determine, to ordain, to enact, to determine upon something, to resolve upon something, to adjudge for oneself, to decree for oneself, to appropriate to oneself","3","0","0","0","0","0"
"4458","cōnscīscere","cōnscīsc","cōnscīscere","cōnsci","cōnscītus","承認する、決定する、決定する、規定する、制定する、何かを決定する、何かを解決する、自分で裁定する、自分で決定する、自分に適切にする","to approve of, to decree, to determine, to ordain, to enact, to determine upon something, to resolve upon something, to adjudge for oneself, to decree for oneself, to appropriate to oneself","3","0","0","0","0","0"
"4460","cōnsīdere","cōnsīd","cōnsīdere","cōnsēd","cōnsessus","座る、着席する、和解する、裁判官として座る、下宿する","to sit down, to be seated, to settle, to sit as judge, to lodge","3","0","0","0","0","0"
"4461","cōnsilēscere","cōnsilēsc","cōnsilēscere","cōnsiluī","-","静かになる、沈黙する、沈黙する","to become still, to keep silent, to fall silent","3","0","1","0","0","0"
"4462","cōnsternere","cōnstern","cōnsternere","cōnstrāv","cōnstrātus","まく、わらぶきする","to strew, to thatch","3","0","0","0","0","0"
"4463","cōnsuēfacere","cōnsuēfaci","cōnsuēfacere","cōnsuēfēc","cōnsuēfactus","慣れる、慣れる","to get accustomed, to get used to","3a","0","0","0","0","0"
"4464","consuescere","consuesc","consuescere","-","-","慣れる、慣れる、慣れる、傾向がある、性交する","to accustom, to inure, to habituate, to tend to, to have sexual intercourse with","3","0","1","0","1","0"
"4465","contabescere","contabesc","contabescere","-","-","ゆっくりと浪費する、消耗する","to waste slowly away, to be consumed","3","0","1","0","1","0"
"4466","conterere","conter","conterere","contrīv","contrītus","粉々に砕く、粉々に砕く、傷つく、砕ける、すり減る、すり減る、消費する、浪費する、浪費する","to grind to pieces, to crush to pieces, to bruise, to crumble, to wear down to wear away, to consume, to waste, to squander","3","0","0","0","0","0"
"4467","conticēscere","conticēsc","conticēscere","-","-","沈黙する、静まる、辞退する、立ち止まる、沈黙する","to fall silent, to come to rest, to decline, to stop, to silence","3","0","1","0","1","0"
"4468","conticīscere","conticīsc","conticīscere","-","-","沈黙する、静まる、辞退する、立ち止まる、沈黙する","to fall silent, to come to rest, to decline, to stop, to silence","3","0","1","0","1","0"
"4469","contremescere","contremesc","contremescere","-","-","震える、動揺する、恐れる","to tremble all over, to waver, to be afraid of","3","0","1","0","1","0"
"4470","contremiscere","contremisc","contremiscere","-","-","震える、動揺する、恐れる","to tremble all over, to waver, to be afraid of","3","0","0","0","1","0"
"4471","contundere","contund","contundere","contud","contūsus","完全に鎮圧する、打ちのめして果肉にする、叩いて果肉にする、あざを作る、痛める","to utterly subdue, to beat to pulp, to pound to pulp, to bruise, to make sore","3","0","0","0","0","0"
"4472","convalēscere","convalēsc","convalēscere","-","-","回復する、力を得る","to recover, to gain strength","3","0","1","0","1","0"
"4473","convincere","convinc","convincere","convīc","convictus","説得する、征服する、立証する、有罪判決を下す、罪を認める","to convince, to conquer, to establish, to convict, to find guilty","3","0","0","0","0","0"
"4474","corrumpere","corrump","corrumpere","corrūp","corruptus","倒錯する、腐敗する、堕落する、感染する、贈り物によって自分自身を獲得する、賄賂を贈る、台無しにする、腐敗させる、汚染する、汚染する、誘惑する、誘惑する","to pervert, to corrupt, to deprave, to infect, to gain to myself by gifts, to bribe, to spoil, to rot, to taint, to contaminate, to tempt, to seduce","3","0","0","0","0","0"
"4475","crēbēscere","crēbēsc","crēbēscere","-","-","頻繁になる、増加する、強くなる、増加する、広まる、広く報道される","to become frequent, to increase, to grow strong, to be on rise, to be spread, to be generally reported","3","0","0","0","1","0"
"4476","crēbrēscere","crēbrēsc","crēbrēscere","-","-","頻繁になる、増加する、強くなる、増加する、広まる、広く報道される","to become frequent, to increase, to grow strong, to be on rise, to be spread, to be generally reported","3","0","0","0","1","0"
"4477","crūdēscere","crūdēsc","crūdēscere","crūdu","-","厳しくなる、暴力的になる、悪化する","to grow harsh, to grow violent, to grow worse","3","0","0","0","0","0"
"4479","dēcipere","dēcipi","dēcipere","dēcēp","dēceptus","捕まえる、罠にかける、罠にかける、だます、誤解させる、だます、逃れる、ごまかす","to catch, to ensnare, to entrap, to deceive, to mislead, to beguile, to elude, to cheat","3a","0","0","0","0","0"
"4480","dēcrēscere","dēcrēsc","dēcrēscere","dēcrēv","-","少なくなる、短くなる、減少する、衰える、減少する、消滅する、衰退する、姿を消す、衰退する","to grow less, to grow shorter, to decrease, to wane, to dwindle, to vanish, to fade, to disappear, to pass away by diminution","3","0","1","0","0","0"
"4481","dēcumbere","dēcumb","dēcumbere","dēcubu","dēcubitus","横になる","to lie down","3","0","0","0","0","0"
"4482","dēdīscere","dēdīsc","dēdīscere","dēdīdic","-","学ぶことを忘れる、偽造する","to unlearn, to forge","3","0","1","0","0","0"
"4483","dēfervēscere","dēfervēsc","dēfervēscere","-","-","沸騰を止める、冷やす、落ち着かせる","to stop boilling, to cool off, to calm down","3","0","1","0","1","0"
"4485","dēflorēscere","dēflorēsc","dēflorēscere","-","-","花を咲かせる、萎む、萎れる、枯れる、枯れる","to shed blossom, to fade, to wither, to decay, to decline","3","0","1","0","1","0"
"4486","dēfodere","dēfodi","dēfodere","dēfōd","dēfossus","埋める、掘り下げる、掘り起こす","to bury, to dig down, to dig up","3a","0","0","0","0","0"
"4487","dēfringere","dēfring","dēfringere","dēfrēg","dēfrāctus","断ち切る","to break off","3","0","0","0","0","0"
"4488","dēfugere","dēfugi","dēfugere","dēfūg","dēfugitus","逃げる、避ける","to escape, to avoid","3a","0","0","0","0","0"
"4489","dēfundere","dēfund","dēfundere","dēfūd","dēfūsus","注ぐ","to pour down","3","0","0","0","0","0"
"4490","dēhīscere","dēhisc","dēhīscere","-","-","隙間を空ける","to leave gap","3","0","1","0","1","0"
"4491","dēicere","dēici","dēicere","dēiēc","dēiectus","倒す、倒す","to throw down, to overthrow","3a","0","0","0","0","0"
"4492","dējicere","dējici","dējicere","dējiēc","dējiectus","倒す、倒す","to throw down, to overthrow","3a","0","0","0","0","0"
"4493","dēligere","dēlig","dēligere","dēlēg","dēlēctus","摘み取る、選ぶ、選択する","to pick off, to choose, to select","3","0","0","0","0","0"
"4494","dēlinere","dēlin","dēlinere","dēlēv","dēlitus","にじませる、塗りつける、油をそそぐ、消す、にじませる、しみを付ける","to smear, to daub, to anoint, to obliterate, to smudge, to blot out","3","0","0","0","0","0"
"4495","dēlinquere","dēlinqu","dēlinquere","dēlīqu","dēlictus","義務を怠る、気分を害する","to fail duty, to offend","3","0","0","0","0","0"
"4496","dēliquēscere","dēliquēsc","dēliquēscere","-","-","溶ける、溶解する、消える、消失する","to melt, to dissolve, to vanish, to disappear","3","0","1","0","1","0"
"4497","dēlitēscere","dēlitēsc","dēlitēscere","-","-","隠れる、避難する","to hide, to take refuge","3","0","1","0","1","0"
"4498","delitīscere","delitīsc","delitīscere","-","-","隠れる、避難する","to hide, to take refuge","3","0","1","0","1","0"
"4499","demetere","demet","demetere","demessu","demessus","刈り取る、摘み取る","to reap, to pick","3","0","0","0","0","0"
"4500","dēpāscere","dēpāsc","dēpāscere","dēpāv","dēpāstus","牛を放牧する、荒らす","to pasture cattle, to lay waste","3","0","0","0","0","0"
"4501","dēpellere","dēpell","dēpellere","dēpul","dēpulsus","追い払う、追放する、取り除く","to drive away, to expel, to remove","3","0","0","0","0","0"
"4502","deperdere","deperd","deperdere","dēperdid","dēperditus","破滅する、失う","to ruin, to lose","3","0","0","0","0","0"
"4503","dēpōnere","dēpōn","dēpōnere","dēposu","dēpositus","置く、設置する","to put down, to set up","3","0","0","0","0","0"
"4504","dēpōscere","dēpōsc","dēpōscere","dēpopōsc","-","強制的に要求する、要求する","to demand peremptorily, to require","3","0","1","0","0","0"
"4505","dērelinquere","derelinqu","dērelinquere","dērelīqu","dērelictus","置き去りにする、棄てる、捨てる、遺棄する","to leave behind, to abandon","3","0","0","0","0","0"
"4506","dērigēscere","dērigēsc","dērigēscere","-","-","固くなる、堅くなる、硬くなる、凝る","to become rigid, to stiffen, to curdle","3","0","1","0","1","0"
"4507","dēscīscere","descisc","dēscīscere","dēscīv","dēscītus","自分を解放する、撤退する、立ち去る、亡命する、脱走する、反抗する、脱走する、脱走する、出発する、逸脱する、撤退する、脱落する、不誠実になる","to free myself, to withdraw, to leave, to defect, to desert, to revolt from, todesert to, togo over to, to depart, to deviate, to withdraw from, to fall off from, to be unfaithful to","3","0","1","0","0","0"
"4508","dēsenēscere","dēsenēsc","dēsenēscere","-","-","加齢とともに衰える、死に絶える","to diminish with age, to die away","3","0","1","0","1","0"
"4511","dēsistere","dēsist","dēsistere","dēstit","-","あきらめる、立ち止まる、やめる","to give up, to stand off, to desist from","3","0","1","0","0","0"
"4512","dēsternere","dēstern","dēsternere","dēstrāv","dēstrātus","鞍を外す、その覆いから解放する","to unsaddle, to free from its covering","3","0","0","0","0","0"
"4513","dēterere","dēter","dēterere","dētrīv","dētrītus","擦る、すりつぶす、弱める","to chafe, to grind, to weaken","3","0","0","0","0","0"
"4514","dēvigēscere","dēvigēsc","dēvigēscere","-","-","活力を失う","to lose ones vigor","3","0","1","0","1","0"
"4515","devincere","devinc","devincere","dēvīc","dēvictus","完全に征服する","to conquer entirely","3","0","0","0","0","0"
"4516","didere","did","didere","dīdid","dīditus","配布する、広める","to distribute, to spread","3","0","0","0","0","0"
"4517","diffindere","diffind","diffindere","diffid","diffissus","割る、分割する","to divide, to split","3","0","0","0","0","0"
"4518","diffringere","diffring","diffringere","diffrēg","diffrāctus","粉々になる、分裂する","to shatter, to break up","3","0","0","0","0","0"
"4519","diffugere","diffugi","diffugere","diffūg","diffugitus","違う方向に逃げる","to flee away in different directions","3a","0","0","0","0","0"
"4520","diffundere","diffund","diffundere","diffūd","diffūsus","拡散する、拡散する","to diffuse, to spread out","3","0","0","0","0","0"
"4521","dīgnōscere","dīgnōsc","dīgnōscere","dīnōv","dīnōtus","区別する","to distinguish","3","0","0","0","0","0"
"4522","dīnōscere","dīnōsc","dīnōscere","dīnōv","dīnōtus","区別する","to distinguish","3","0","0","0","0","0"
