"4322","ārdēscere","ārdēsc","ārdēscere","-","-","燃える、発火する、炎症を起こす、噴火する","to kindle, to catch fire, to become inflamed, to erupt","3","0","0","0","1","0"
"4323","āvellere","āvell","āvellere","āvuls","āvulsus","引き裂く、引き裂く、引き裂く、引き抜く、引きちぎる","to tear off, to tear away, to wrest, to pluck off, to rend off","3","0","0","0","0","0"
"4324","ēlūcēscere","ēlūcēsc","ēlūcēscere","-","-","光る、明ける","to shine forth, to dawn","3","0","1","0","1","0"
"4325","ūrere","ūr","ūrere","ussī","ustus","燃やす、消費する、炎症を起こす、苛立たせる、怒る、激怒させる、荒廃させる","to burn, to consume, to inflame, to annoy, to gall, to vex, to rage, to ravage","3","0","0","0","0","0"
"4326","abdere","abd","abdere","abdid","abditus","隠す、隠蔽する、秘密を守る、被せる、被る、抑圧する、覆う、取り除く、片付ける、脇に置く、追放する、自分自身を奪う、立ち去る、行って隠す","to hide, to conceal, to keep secret, to cover, to suppress, to sheathe, to remove, to put away, to set aside, to banish, to betake myself, to go away, to go and hide","3","0","0","0","0","0"
"4327","abicere","abici","abicere","abiēc","abiectus","投げ捨てる、投げ捨てる、投げ捨てる、投げ捨てる、投げ捨てる、捨てる 、減らす、下げる、投げ捨てる、転覆する、打ち負かす、安く売る、過小評価する、浪費する、堕落させる、卑下する、地面に身を投げる、身を投げ出す、自分を堕落させる、放電する 、投げる","to throw down, to throw away, to hurl down, to hurl away, to cast away, to cast aside, to push away, to push aside, to give up, to abandon, to expose, to discard, to humble, to degrade, to reduce, to lower, to cast down, to overthrow, to vanquish, to sell cheaply, to undervalue, to waste, to degrade, to belittle, to throw myself on ground, to throw myself away, to degrade myself, to discharge, to fling, to hurl, to cast, to throw","3a","0","0","0","0","0"
"4328","abigere","abig","abigere","abēg","abāctus","追い払う、抑止する、思いとどまらせる、怖がらせる、病気を取り除く、出産を強制する、中絶を引き起こす、牛を盗む","to drive away, to deter, to discourage, to frighten away, to remove disease, to force birth, to cause abortion, to steal cattle","3","0","0","0","0","0"
"4329","abjicere","abjici","abjicere","abjēc","abjectus","投げ捨てる、投げ捨てる、投げ捨てる、投げ捨てる、投げ捨てる、捨てる 、減らす、下げる、投げ捨てる、転覆する、打ち負かす、安く売る、過小評価する、浪費する、堕落させる、卑下する、地面に身を投げる、身を投げ出す、自分を堕落させる、放電する 、投げる","to throw down, to throw away, to hurl down, to hurl away, to cast away, to cast aside, to push away, to push aside, to give up, to abandon, to expose, to discard, to humble, to degrade, to reduce, to lower, to cast down, to overthrow, to vanquish, to sell cheaply, to undervalue, to waste, to degrade, to belittle, to throw myself on ground, to throw myself away, to degrade myself, to discharge, to fling, to hurl, to cast, to throw","3a","0","0","0","0","0"
"4330","abolēscere","abolēsc","abolēscere","-","-","次第に滅びる、朽ちる、死ぬ、消える、無くなる","to gradually perish, to decay, to die, to disappear, to vanish","3","0","1","0","1","0"
"4331","abrumpere","abrump","abrumpere","abrūp","abruptus","引き裂く、引き裂く、断ち切る、短く切る、断ち切る、終わらせる、終わらせる","to rend, to tear, to sever, to cut short, to break off, to terminate, to end","3","0","0","0","0","0"
"4332","abscindere","abscind","abscindere","abscid","abscissus","引き裂く、引きちぎる、引き裂く、切り離す、引き裂く、切り離す、引き離す","to tear, to rend off, to rend away, to separate, to divide, to cut off, to alienate","3","0","0","0","0","0"
"4333","absistere","absist","absistere","abstit","-","撤退する、立ち去る、去る、やめる、止める、停止する","to withdraw, to depart, to go away from, to desist, to stop from, to cease from","3","0","0","0","0","0"
"4334","abspellere","abspell","abspellere","abspul","abspulsus","追い払う、取り除く","to drive away, to remove","3","0","0","0","0","0"
"4335","accanere","accan","accanere","accecin","-","歌う、一緒に歌う","to sing to, to sing with","3","0","0","0","0","0"
"4336","accredere","accred","accredere","accrēdid","accrēditus","信じる、自分の信念を別の人に譲る、信念を一致させる、完全に信じる","to believe, to yield ones belief to another, to accord belief, to believe fully","3","0","0","0","0","0"
"4337","accrēscere","accresc","accrēscere","-","-","成長する、増やす","to grow, to increase ","3","0","1","0","1","0"
"4338","accumbere","accumb","accumbere","accubu","accubitus","机に寄りかかる、ベッドに横になる、机に着席する","to recline at table, to lie on bed, to take my place at table","3","0","0","0","0","0"
"4339","accurrere","accurr","accurrere","accucurr","accursus","走る、急ぐ、掛かる、突進する","to run, to hasten, to charge, to rush","3","0","0","0","0","0"
"4340","acescere","acesc","acescere","-","-","酸っぱくなる、酸化する","to become sour, to turn sour","3","0","1","0","1","0"
"4341","acquiescere","acquiesc","acquiescere","-","-","休む、休憩する、死ぬ、死に休む、慰めを見つける、楽しむ、喜ぶ、夢中になる、夢中になる","to repose, to rest, to die, to rest in death, to find comfort in, to pleasure in, to rejoice in, to occupy myself in, to occupy myself with","3","0","1","0","1","0"
"4342","acquīrere","acquīr","acquīrere","acquīsīv","acquīsītus","得る、取る、獲得する、取得する、富を蓄積する、お金を蓄積する、獲得する","to acquire, to obtain, to acquire, to amass riches, to amass money, to accrue","3","0","0","0","0","0"
"4343","adcrescere","adcresc","adcrescere","-","-","成長する、増やす","to grow, to increase ","3","0","1","0","1","0"
"4344","adcumbere","adcumb","adcumbere","adcubu","adcubitus","机に寄りかかる、ベッドに横になる、机に着席する","to recline at table, to lie on bed, to take my place at table","3","0","0","0","0","0"
"4345","adcurrere","adcurr","adcurrere","adcucurr","adcursus","走る、急ぐ、掛かる、突進する","to run, to hasten, to charge, to rush","3","0","0","0","0","0"
"4346","addiscere","addisc","addiscere","addidic","-","加えて学ぶ、さらに学ぶ、情報を得る、聞く、学ぶ","to learn in addition to, to learn further, to be  informed, to hear, to learn","3","0","1","0","0","0"
"4347","addere","add","addere","addid","additus","追加する、置く、置く、人を置く、物を別の人に置く、取得する、持ってくる、追加する、追加する、追加する","to add, to put, to place, to lay person, to lay thing to another, to acquire, to bring to, to add to, to annex, to augment","3","0","0","0","0","0"
"4348","adedere","aded","adedere","adēd","adēsus","食べ始める、噛む、かじる、かじる、完全に消費する、食べ尽くす、消耗させる、すり減らす、焦がす、浸食する、浪費する","to begin to eat, to bite, to nibble at, to gnaw, to consume entirely, to eat up, to exhaust, to wear down, to scorch, to erode, to squander","3","0","0","0","0","0"
"4349","adficere","adfici","adficere","adfēc","adfectus","治療する、管理する、処理する、影響を与える、影響を与える、攻撃する、苦しめる、弱める、損なう","to treat, to manage, to handle, to influence, to have  effect on, to attack, to afflict, to weaken, to impair","3a","0","0","0","0","0"
"4350","adfodere","adfodi","adfodere","adfōd","adfossus","加えて掘る、掘って追加する","to dig in addition to, to add by digging","3a","0","0","0","0","0"
"4351","adfundere","adfund","adfundere","adfūd","adfūsus","注ぐ、振りかける、まぶす","to pour, to sprinkle onto, to scatter onto","3","0","0","0","0","0"
"4352","adgnoscere","adgnosc","adgnoscere","adgnōv","adgnitus","認識する、理解する、見分ける、知る、知る、知覚する、認める、主張する","to recognize, to realize, to discern, to become acquainted with, to know, to perceive, to acknowledge, to claim","3","0","0","0","0","0"
"4353","adicere","adici","adicere","adiēc","adiectus","投げる、投げる、キャストする、物を投げる、物を投げる、物を投げる、物を飛ばす、心を向ける、目を向ける、注意を向ける、向ける、取り付ける 適用する、割り当てる、追加する、増やす、追加する、強化する、入札に追加する、高値をつける、既に述べたことに追加する、変更する","to throw, to hurl, to cast, to fling object to, to fling object towards, to fling object at, to direct my mind, to direct my eye, to direct my attention to, turn to, to attach, to insert, to apply, to assign, to add, to increase, to add to, to intensify, to add to bid, to outbid, to add to something that has already been said, to modify","3a","0","0","0","0","0"
"4354","adigere","adig","adigere","adēg","adāctus","運転する、投げる、求める、要求する","to drive, to hurl, to exact","3","0","0","0","0","0"
"4355","adimere","adim","adimere","adēm","adēmptus","奪う、奪う、奪う、奪う、奪う、盗む、捕まえる、状況から取り除く、救う、救う","to take away, to deprive of, to snatch away, to carry off, to steal, to capture, to remove from situation, to save, to rescue","3","0","0","0","0","0"
"4356","adjicere","adjici","adjicere","adjiēc","adjiectus","投げる、投げる、キャストする、物を投げる、物を投げる、物を投げる、物を飛ばす、心を向ける、目を向ける、注意を向ける、向ける、取り付ける 適用する、割り当てる、追加する、増やす、追加する、強化する、入札に追加する、高値をつける、既に述べたことに追加する、変更する","to throw, to hurl, to cast, to fling object to, to fling object towards, to fling object at, to direct my mind, to direct my eye, to direct my attention to, turn to, to attach, to insert, to apply, to assign, to add, to increase, to add to, to intensify, to add to bid, to outbid, to add to something that has already been said, to modify","3a","0","0","0","0","0"
"4357","adlegere","adleg","adlegere","adlēg","adlēctus","選択する、選ぶ、募る、選出する、認める","to select, to choose, to recruit, to elect, to admit","3","0","0","0","0","0"
"4358","adlinere","adlin","adlinere","adlēv","adlitus","広がる、付着する","to spread over, to adhere to","3","0","0","0","0","0"
"4359","adnectere","adnect","adnectere","adnexu","adnexus","縛る、結びつける、接続する、付属する","to bind to, to tie to, to connect, to annex","3","0","0","0","0","0"
"4360","adolescere","adolesc","adolescere","-","-","成長する、大人になる、大人びる、育つ、熟す、成熟する、成長する、増加する、増える、増大する、大きくなる","to grow up, to become adult, to mature, to grow, to increase, to augment, to become greater","3","0","1","0","1","0"
"4361","adpellere","adpell","adpellere","adpul","adpulsus","運転する、移動する、上陸する、陸に上がる","to drive to, to move to, to land, to put ashore","3","0","0","0","0","0"
"4362","adponere","adpon","adponere","adposu","adpositus","任命する、割り当てる、近くに置く、テーブルの前に置く、奉仕する、置く、適用する、追加する","to appoint, to assign, to place near, to set before on table, to serve up, to put, to apply, to add to","3","0","0","0","0","0"
"4363","adquiescere","adquiesc","adquiescere","adquīsīv","adquīsītus","休む、休憩する、死ぬ、死に休む、慰めを見つける、楽しむ、喜ぶ、夢中になる、夢中になる","to repose, to rest, to die, to rest in death, to find comfort in, to pleasure in, to rejoice in, to occupy myself in, to occupy myself with","3","0","0","0","0","0"
"4364","adquirere","adquir","adquirere","adquīsīv","adquīsītus","得る、取る、獲得する、取得する、富を蓄積する、お金を蓄積する、獲得する","to acquire, to obtain, to acquire, to amass riches, to amass money, to accrue","3","0","0","0","0","0"
"4365","adsciscere","adscisc","adsciscere","adscīv","adscītus","知識のあるものを受け取る、知識のあるものを受け取る、承認する、受け入れる、認識する、採用する、誰かを自分自身に連れて行く、誰かを自分自身に受け入れる、連れてくる、勝つ、募集する、採用する、 自分自身と結びつける、想定する、自分自身に何かを主張する、自分自身に何かを傲慢にする、主張する","to take something with knowledge, to receive something with knowledge, to approve, to accept, to recognize, to adopt, to take someone to myself, to receive someone to myself, to bring in, to win over, to recruit, to adopt, to associate with myself, to assume, to claim something to myself, to arrogate something to myself, to lay claim to","3","0","0","0","0","0"
"4366","adserere","adser","adserere","adsēv","adsitus","種をまく、植える、何かの近くに置く","to sow, to plant, to set near something","3","0","0","0","0","0"
"4367","adsidere","adsid","adsidere","adsēd","-","座る","to sit down","3","0","1","0","0","0"
"4368","adsistere","adsist","adsistere","adstit","-","どこかに身を置く、立つ、待機する、身を寄せる、近づく、来る、位置に止まる、位置に止まる、弁護する、助ける、助ける、裁判で人の前に立つ、 裁きの前に立つ","to place oneself somewhere, to stand at, to stand by, to post oneself, to approach, to come upon, to stop in position, to halt in position, to defend, to assist, to aid, to stand before one on trial, to stand before one in judgement","3","0","1","0","0","0"
"4369","adsternere","adstern","adsternere","adstrāv","adstrātus","ひれ伏す、仰向けになる","to prostrate oneself, to lie pron","3","0","0","0","0","0"
"4370","adsuēscere","adsuēsc","adsuēscere","adsuēv","adsuētus","慣れる、馴染む、習慣になる、習慣化する","to get used to, to become accustomed with, to inure to, to accustom","3","0","0","0","0","0"
"4371","adterere","adter","adterere","adtrīv","adtrītus","すり減る、すり減る、すりつぶす、こすり落とす、弱める、損なう、すり減る","to wear away, to rub away, to grind, to chafe, to weaken, to impair, to attrit","3","0","0","0","0","0"
"4372","adtingere","adting","adtingere","adtig","adtāctus","接触する、触れる、攻撃する、攻める、倒す、触れる、味わう、近づく、達する、着く、到着する、隣接する、近くに横たわる、接近する、接する、触れる、 影響する、興味を引く、到達する、わずかに言及する、触れる、引き受ける、参加する、関与する、類似する、所属する、属する、関する、関係する、関連する、連なる、懸念する","to come in contact with, to touch, to assault, to strike, to attack, to touch, to taste, to approach, to reach, to arrive at, to be contiguous to, to lie near, to border upon, to touch, to affect, to interest, to reach, to mention slightly, to touch upon, to undertake, to enter upon, to engage in, to be similar, to belong, to relate to, to appertain to, to concern","3","0","0","0","0","0"
"4373","advesperāscere","advesperasc","advesperāscere","-","-","暮れる","to evening","3a","0","1","0","0","1"
"4374","affodere","affodi","affodere","affōd","affossus","加えて掘る、掘って追加する","to dig in addition to, to add by digging","3a","0","0","0","0","0"
"4375","affugere","affugi","affugere","affūg","-","逃げる、逃げる、逃げる、消える、逃げる","to flee, to run away, to escape, to vanish, to flee from","3a","0","1","0","0","0"
"4376","affundere","affund","affundere","affūd","affūsus","注ぐ、振りかける、まぶす","to pour, to sprinkle onto, to scatter onto","3","0","0","0","0","0"
"4377","agnoscere","agnosc","agnoscere","agnōv","agnitus","認識する、理解する、見分ける、知る、知る、知覚する、認める、主張する","to recognize, to realize, to discern, to become acquainted with, to know, to perceive, to acknowledge, to claim","3","0","0","0","0","0"
"4378","allegere","alleg","allegere","allēg","allēctus","選択する、選ぶ、募る、選出する、認める","to select, to choose, to recruit, to elect, to admit","3","0","0","0","0","0"
"4379","allinere","allin","allinere","allēv","allitus","広がる、付着する","to spread over, to adhere to","3","0","0","0","0","0"
"4380","ambedere","ambed","ambedere","ambēd","ambēsus","食べる、かじる、浸食する、浪費する、消費する","to eat around, to gnaw around, to erode, to waste, to consume","3","0","0","0","0","0"
"4381","annectere","annect","annectere","annexu","annexus","縛る、結びつける、接続する、付属する","to bind to, to tie to, to connect, to annex","3","0","0","0","0","0"
"4382","anquīrere","anquīr","anquīrere","anquīsīv","anquīsītus","求める、調査する、調査する、司法的に調べる、起訴する","to seek, toresearch, toinvestigate, toexamine judicially, to indict","3","0","0","0","0","0"
"4383","antecapere","antecapi","antecapere","antecēp","anteceptus","得る、受け取る、前に取る、前もって取る","to obtain, to receive, to take before, to take beforehand","3a","0","0","0","0","0"
"4384","antepōnere","antepōn","antepōnere","anteposu","antepositus","前に置く、好む","to put in front of, to place in front of, to prefer","3","0","0","0","0","0"
"4385","appellere","appell","appellere","appul","appulsus","運転する、移動する、上陸する、上陸する","to drive to, to move to, to land, to put ashore","3","0","0","0","0","0"
"4386","apponere","appon","apponere","apposu","appositus","任命する、割り当てる、近くに置く、テーブルの前に置く、奉仕する、置く、適用する、追加する","to appoint, to assign, to place near, to set before on table, to serve up, to put, to apply, to add to","3","0","0","0","0","0"
"4387","arescere","aresc","arescere","āru","-","枯れる、乾く、枯れる、枯れる","to become dry, to dry out, to wither, to languish","3","0","1","0","0","0"
"4388","asciscere","ascisc","asciscere","ascīv","ascītus","知識のあるものを受け取る、知識のあるものを受け取る、承認する、受け入れる、認識する、採用する、誰かを自分自身に連れて行く、誰かを自分自身に受け入れる、連れてくる、勝つ、募集する、採用する、 自分自身と結びつける、想定する、自分自身に何かを主張する、自分自身に何かを傲慢にする、主張する","to take something with knowledge, to receive something with knowledge, to approve, to accept, to recognize, to adopt, to take someone to myself, to receive someone to myself, to bring in, to win over, to recruit, to adopt, to associate with myself, to assume, to claim something to myself, to arrogate something to myself, to lay claim to","3","0","0","0","0","0"
"4389","aspellere","aspell","aspellere","aspul","aspulsus","追い払う、取り除く","to drive away, to remove","3","0","0","0","0","0"
"4390","asserere","asser","asserere","assēv","assitus","種をまく、植える、何かの近くに置く","to sow, to plant, to set near something","3","0","0","0","0","0"
"4391","assidere","assid","assidere","assēd","-","座る","to sit down","3","0","1","0","0","0"
"4392","assistere","assist","assistere","astit","-","どこかに身を置く、立つ、待機する、身を寄せる、近づく、来る、位置に止まる、位置に止まる、弁護する、助ける、助ける、裁判で人の前に立つ、 裁きの前に立つ","to place oneself somewhere, to stand at, to stand by, to post oneself, to approach, to come upon, to stop in position, to halt in position, to defend, to assist, to aid, to stand before one on trial, to stand before one in judgement","3","0","1","0","0","0"
"4393","assuēscere","assuēsc","assuēscere","asuēv","assuētus","慣れる、馴染む、習慣になる、習慣化する","to get used to, to become accustomed with, to inure to, to accustom","3","0","0","0","0","0"
"4394","asternere","astern","asternere","astrāv","astrātus","ひれ伏す、仰向けになる","to prostrate oneself, to lie pron","3","0","0","0","0","0"
"4395","atterere","atter","atterere","attrīv","attrītus","すり減る、すり減る、すりつぶす、こすり落とす、弱める、損なう、すり減る","to wear away, to rub away, to grind, to chafe, to weaken, to impair, to attrit","3","0","0","0","0","0"
"4396","attingere","atting","attingere","attig","attāctus","接触する、触れる、攻撃する、攻める、倒す、触れる、味わう、近づく、達する、着く、到着する、隣接する、近くに横たわる、接近する、接する、触れる、 影響する、興味を引く、到達する、わずかに言及する、触れる、引き受ける、参加する、関与する、類似する、所属する、属する、関する、関係する、関連する、連なる、懸念する","to come in contact with, to touch, to assault, to strike, to attack, to touch, to taste, to approach, to reach, to arrive at, to be contiguous to, to lie near, to border upon, to touch, to affect, to interest, to reach, to mention slightly, to touch upon, to undertake, to enter upon, to engage in, to be similar, to belong, to relate to, to appertain to, to concern","3","0","0","0","0","0"
"4397","aufugere","aufugi","aufugere","aufūg","-","逃げる、逃げる、逃げる、消える、逃げる","to flee, to run away, to escape, to vanish, to flee from","3a","0","0","0","0","0"
"4398","avfugere","avfugi","avfugere","avfūg","-","逃げる、逃げる、逃げる、消える、逃げる","to flee, to run away, to escape, to vanish, to flee from","3a","0","0","0","0","0"
"4399","candēscere","candēsc","candēscere","-","-","明るくなる、明るくなる、輝きを放つ、真っ赤になる","to brighten, to grow brighter, to radiate, to become red hot","3","0","1","0","1","0"
"4400","cānēscere","cānēsc","cānēscere","-","-","白くなる、白くなる、灰色になる、白くなる","to whiten, to become white, to become grey, to become hoary","3","0","1","0","1","0"
"4401","circumagere","circumag","circumagere","circumēg","circumāctus","円を描くように運転する、円を描くように曲がる、振り向く、車輪を回す","to drive in circle, to turn in circle, to turn round, to turn wheel","3","0","0","0","0","0"
"4402","circumfodere","circumfodi","circumfodere","circumfōd","circumfossus","掘り回る","to dig around, to dig about","3a","0","0","0","0","0"
"4403","circumfundere","circumfund","circumfundere","circumfūd","circumfūsus","注ぎ出す、注ぎ込む、液体で囲む、群がる、圧倒する","to pour out, to pour round, to surround with liquid, to crowd around, to overwhelm","3","0","0","0","0","0"
"4404","circumicere","circumici","circumicere","circumiēc","circumiectus","投げる、放る、配置する、投げる、囲む、取り囲む、包み込む","to throw, to cast, to place around, to hurl around, to surround, to encompass, to envelop","3a","0","0","0","0","0"
"4405","circumlegere","circumleg","circumlegere","circumlēg","circumlēctus","航海する","to sail around","3","0","0","0","0","0"
"4406","circumlinere","circumlin","circumlinere","circumlev","circumlitus","全体に塗る、全体に塗る","to smear all over, to anoint all over","3","0","0","0","0","0"
"4407","circumponere","circumpon","circumponere","circumposu","circumpositus","配置する、配置する、配置する","to place around, to put around, to set around","3","0","0","0","0","0"
"4408","circumsistere","circumsist","circumsistere","circumstitī","-","立つ、集まる、取り囲む、取り囲む","to stand around, to gather around, to surround, to beset","3","0","1","0","0","0"
"4409","clarēscere","clarēsc","clarēscere","-","-","照らされる、明るくなる","to be illuminated, to brighten","3","0","1","0","1","0"
"4410","coacēscere","coacēsc","coacēscere","-","-","酸っぱくなる、酸っぱくなる、劣化する、腐敗する","to become acid, to become asour, to deteriorate, to become corrupt","3","0","1","0","1","0"
"4411","coalēscere","coalēsc","coalēscere","-","-","団結する、合体する、合わさる","to unite together, to coalesce","3","0","1","0","1","0"
"4412","coemere","coem","coemere","coēm","coēmptus","買いあさる、買い上げる、買収する","to purchase up, to buy up","3","0","0","0","0","0"
"4413","cohorrēscere","cohorrēsc","cohorrēscere","-","-","身震いする、恐怖に震える、寒さに震える","to shudder, to shiver with fear, to shiver with cold","3","0","1","0","1","0"
